{  
   "self":{  
      "name":"cdap.helloworld.mock.catalog.testing.endnode",
      "version":"0.7.1",
      "description":"cdap test component",
      "component_type":"cdap"
   },
   "streams":{  
      "subscribes": [],
      "publishes": [{
         "format": "std.empty",
         "version": "1.0.6",
         "config_key": "stream_publish_example",
         "type": "http"
      }]
   },
   "services":{  
      "calls": [],
      "provides":[  
         {  
            "request":{  
               "format":"std.empty",
               "version":"1.0.6"
            },
            "response":{  
               "format":"std.empty",
               "version":"1.0.6"
            },
            "service_name":"Greeting",
            "service_endpoint":"greet",
            "verb":"GET"
         }
      ]
   },
   "parameters": {  
       "app_config" : [
                         {"name" : "some_param",
                         "description" : "some desc",
                         "value" : "some_value"}
                      ],
       "app_preferences" : [
                             {"name" : "some_param2",
                              "description" : "some desc2",
                              "value" : "some_value2"}
                           ],
       "program_preferences" : [{"program_type" : "flows", "program_id" : "WhoFlow", "program_pref" : [{"name" : "some_param3","description" : "some desc3", "value" : "some_value3"}]}]
   },
   "auxilary": {
    "streamname":"who",
    "artifact_name" : "HelloWorld",
    "artifact_version" : "3.4.3",
    "programs" : [
                    {"program_type" : "flows", "program_id" : "WhoFlow"},
                    {"program_type" : "services", "program_id" : "Greeting"}
                  ],
    "namespace" : "hw"
    },
  "artifacts": [
    {
      "uri": "http://make-me-valid/jar_files/HelloWorld-3.4.3.jar",
      "type": "jar"
    }
  ]
}
